{
  "$schema": "https://json-schema.org/draft/2020-12/schema",
  "$id": "https://jayclock.dev/fm/v4/rule.schema.json",
  "title": "Fulfillment Modeling CEL rule",
  "type": "object",
  "required": [
    "type",
    "id",
    "kind",
    "label",
    "description",
    "contextRef",
    "bindings",
    "expression",
    "resultType"
  ],
  "properties": {
    "type": { "const": "rule" },
    "id": { "$ref": "#/$defs/id" },
    "kind": {
      "enum": [
        "derivation",
        "precondition",
        "invariant",
        "eligibility",
        "completion",
        "breach"
      ]
    },
    "label": { "type": "string", "minLength": 1 },
    "description": {
      "description": "Business-language explanation. Model terms use the canonical Chinese（English） name and a separate concrete Entity ID, for example 付款请求（Payment Request）[request.payment]. The ID is not an English business name.",
      "type": "string",
      "minLength": 1
    },
    "contextRef": { "$ref": "#/$defs/id" },
    "fulfillmentRef": { "$ref": "#/$defs/id" },
    "bindings": {
      "type": "object",
      "propertyNames": { "pattern": "^[A-Za-z_][A-Za-z0-9_]*$" },
      "additionalProperties": { "$ref": "#/$defs/binding" }
    },
    "expression": { "type": "string", "minLength": 1 },
    "resultType": { "$ref": "#/$defs/valueType" },
    "target": {
      "type": "object",
      "required": ["entityRef", "attribute"],
      "properties": {
        "entityRef": { "$ref": "#/$defs/id" },
        "attribute": {
          "type": "string",
          "pattern": "^[a-z][a-z0-9]*(?:_[a-z0-9]+)*$"
        }
      },
      "additionalProperties": false
    },
    "notes": { "type": "string", "minLength": 1 }
  },
  "allOf": [
    {
      "if": {
        "properties": { "kind": { "const": "derivation" } },
        "required": ["kind"]
      },
      "then": { "required": ["target"] }
    },
    {
      "if": {
        "properties": { "kind": { "enum": ["completion", "breach"] } },
        "required": ["kind"]
      },
      "then": { "required": ["fulfillmentRef"] }
    }
  ],
  "additionalProperties": false,
  "$defs": {
    "id": {
      "type": "string",
      "pattern": "^[a-z][a-z0-9]*(?:[.-][a-z0-9]+)*$"
    },
    "valueType": {
      "enum": [
        "bool",
        "int",
        "uint",
        "double",
        "decimal",
        "string",
        "bytes",
        "timestamp",
        "duration",
        "date",
        "money",
        "enum",
        "id",
        "list",
        "map",
        "dynamic"
      ]
    },
    "binding": {
      "type": "object",
      "oneOf": [
        {
          "required": ["ref"],
          "properties": {
            "ref": { "$ref": "#/$defs/id" },
            "cardinality": {
              "description": "Whether the CEL binding is one modeled instance or a collection of instances.",
              "enum": ["one", "many"]
            }
          },
          "additionalProperties": false
        },
        {
          "required": ["type"],
          "properties": { "type": { "$ref": "#/$defs/valueType" } },
          "additionalProperties": false
        }
      ]
    }
  }
}
