{
  "type": "rule",
  "id": "rule.invoice-evidence-ready",
  "kind": "precondition",
  "label": "开票确认的证据前提",
  "description": "当前时刻前已形成与开票申请编号和抬头一致的发票时，允许形成开票确认。",
  "contextRef": "context.product-procurement",
  "bindings": {
    "request": {
      "ref": "request.invoice"
    },
    "proofs": {
      "ref": "evidence.invoice",
      "cardinality": "many"
    },
    "now": {
      "type": "timestamp"
    }
  },
  "expression": "proofs.exists(p, p.request_number == request.request_number && p.created_at <= now && p.invoice_title == request.invoice_title)",
  "resultType": "bool",
  "notes": "形成目标前核对已存在、当前可见且属于本申请的补充证据；now是判断时刻，不用于生成凭证时间。",
  "fulfillmentRef": "fulfillment.invoice"
}
