{
  "type": "rule",
  "id": "rule.access-eligible",
  "kind": "precondition",
  "label": "本读者对本版本具备访问资格",
  "description": "内容访问请求（request.access）与订阅合同（contract.subscription）匹配，且读者持有未在请求开始前退款的访问所需付款证明（role.access-payment），或持有请求开始前已生效的免费恢复凭证（confirmation.restore）时，判定具备访问资格。",
  "contextRef": "context.subscription",
  "bindings": {
    "agreement": {
      "ref": "contract.subscription"
    },
    "request": {
      "ref": "request.access"
    },
    "payments": {
      "ref": "role.access-payment",
      "cardinality": "many"
    },
    "refunds": {
      "ref": "confirmation.refund",
      "cardinality": "many"
    },
    "restorations": {
      "ref": "confirmation.restore",
      "cardinality": "many"
    }
  },
  "expression": "request.subscription_id == agreement.subscription_id &&\nrequest.reader_id == agreement.reader_id && request.column_id ==\nagreement.column_id && ((payments.exists(p, p.subscription_id ==\nagreement.subscription_id && p.reader_id == agreement.reader_id &&\np.column_id == agreement.column_id && p.amount_minor_units ==\nagreement.amount_minor_units && p.currency == agreement.currency &&\np.success && p.confirmed_at >= agreement.signed_at && p.confirmed_at\n<= agreement.signed_at + duration(string(agreement.payment_seconds)\n+ \"s\")) && !(refunds.exists(p, p.subscription_id ==\nrequest.subscription_id && p.reader_id == request.reader_id &&\np.column_id == request.column_id && p.settled &&\np.amount_minor_units == agreement.amount_minor_units && p.currency\n== agreement.currency && p.confirmed_at <= request.started_at)) &&\nrequest.edition_id == agreement.edition_id) ||\nrestorations.exists(p, p.subscription_id == request.subscription_id\n&& p.reader_id == request.reader_id && p.column_id ==\nrequest.column_id && p.edition_id == request.edition_id &&\np.charged_minor_units == 0 && p.restored && p.confirmed_at <=\nrequest.started_at))",
  "resultType": "bool",
  "fulfillmentRef": "fulfillment.access"
}
