{
  "type": "rule",
  "id": "rule.access-deadline",
  "kind": "derivation",
  "label": "计算付费内容访问请求截止",
  "description": "以内容访问请求（request.access）的开始时间为基准增加订阅合同（contract.subscription）约定的访问响应秒数，得到该请求的截止时间。",
  "contextRef": "context.subscription",
  "bindings": {
    "agreement": {
      "ref": "contract.subscription"
    },
    "request": {
      "ref": "request.access"
    }
  },
  "expression": "request.started_at + duration(string(agreement.access_seconds) +\n\"s\")",
  "resultType": "timestamp",
  "target": {
    "entityRef": "request.access",
    "attribute": "expired_at"
  },
  "fulfillmentRef": "fulfillment.access"
}
