{
  "type": "rule",
  "id": "rule.refund-completed",
  "kind": "completion",
  "label": "全部订阅费已按时到账",
  "description": "断更退款请求（request.refund）与订阅合同（contract.subscription）和退款所需付款证明（role.refund-payment）匹配，存在请求前形成的断更下架记录（evidence.discontinuation），并在期限内恰有一份全额退款到账凭证（confirmation.refund）时，判定断更退款履约（fulfillment.refund）完成。",
  "contextRef": "context.subscription",
  "bindings": {
    "agreement": {
      "ref": "contract.subscription"
    },
    "request": {
      "ref": "request.refund"
    },
    "payments": {
      "ref": "role.refund-payment",
      "cardinality": "many"
    },
    "notices": {
      "ref": "evidence.discontinuation",
      "cardinality": "many"
    },
    "confirmations": {
      "ref": "confirmation.refund",
      "cardinality": "many"
    }
  },
  "expression": "request.subscription_id == agreement.subscription_id &&\nrequest.reader_id == agreement.reader_id && request.column_id ==\nagreement.column_id && payments.exists(p, p.subscription_id ==\nagreement.subscription_id && p.reader_id == agreement.reader_id &&\np.column_id == agreement.column_id && p.amount_minor_units ==\nagreement.amount_minor_units && p.currency == agreement.currency &&\np.success && p.confirmed_at >= agreement.signed_at && p.confirmed_at\n<= agreement.signed_at + duration(string(agreement.payment_seconds)\n+ \"s\")) && notices.exists(n, n.subscription_id ==\nrequest.subscription_id && n.reader_id == request.reader_id &&\nn.column_id == request.column_id && n.created_at <=\nrequest.started_at && n.created_at > n.missed_due_at +\nduration(\"604800s\") && n.missing_content && !n.rescheduled &&\nn.delisted) && request.amount_minor_units ==\nagreement.amount_minor_units && request.currency ==\nagreement.currency && confirmations.filter(c, c.request_id ==\nrequest.request_id && c.subscription_id == request.subscription_id\n&& c.reader_id == request.reader_id && c.column_id ==\nrequest.column_id && c.confirmed_at >= request.started_at &&\nc.confirmed_at <= request.expired_at && c.settled &&\nc.amount_minor_units == request.amount_minor_units && c.currency ==\nrequest.currency).size() == 1",
  "resultType": "bool",
  "fulfillmentRef": "fulfillment.refund"
}
