{
  "type": "rule",
  "id": "rule.content-readable",
  "kind": "precondition",
  "label": "按查询时刻检索仍有资格的本人章节",
  "description": "内容访问请求（request.access）与订阅合同（contract.subscription）匹配，当前查询时刻访问所需付款证明（role.access-payment）尚未退款或请求前已有免费恢复凭证（confirmation.restore），且该请求曾按时形成内容提供凭证（confirmation.access）时，允许检索指定章节。",
  "contextRef": "context.subscription",
  "bindings": {
    "agreement": {
      "ref": "contract.subscription"
    },
    "request": {
      "ref": "request.access"
    },
    "payments": {
      "ref": "role.access-payment",
      "cardinality": "many"
    },
    "refunds": {
      "ref": "confirmation.refund",
      "cardinality": "many"
    },
    "restorations": {
      "ref": "confirmation.restore",
      "cardinality": "many"
    },
    "confirmations": {
      "ref": "confirmation.access",
      "cardinality": "many"
    },
    "now": {
      "type": "timestamp"
    }
  },
  "expression": "request.subscription_id == agreement.subscription_id &&\nrequest.reader_id == agreement.reader_id && request.column_id ==\nagreement.column_id && ((payments.exists(p, p.subscription_id ==\nagreement.subscription_id && p.reader_id == agreement.reader_id &&\np.column_id == agreement.column_id && p.amount_minor_units ==\nagreement.amount_minor_units && p.currency == agreement.currency &&\np.success && p.confirmed_at >= agreement.signed_at && p.confirmed_at\n<= agreement.signed_at + duration(string(agreement.payment_seconds)\n+ \"s\")) && !(refunds.exists(p, p.subscription_id ==\nrequest.subscription_id && p.reader_id == request.reader_id &&\np.column_id == request.column_id && p.settled &&\np.amount_minor_units == agreement.amount_minor_units && p.currency\n== agreement.currency && p.confirmed_at <= now)) &&\nrequest.edition_id == agreement.edition_id) ||\nrestorations.exists(p, p.subscription_id == request.subscription_id\n&& p.reader_id == request.reader_id && p.column_id ==\nrequest.column_id && p.edition_id == request.edition_id &&\np.charged_minor_units == 0 && p.restored && p.confirmed_at <=\nrequest.started_at)) && confirmations.filter(c, c.request_id ==\nrequest.request_id && c.subscription_id == request.subscription_id\n&& c.reader_id == request.reader_id && c.column_id ==\nrequest.column_id && c.confirmed_at >= request.started_at &&\nc.confirmed_at <= request.expired_at && c.chapter_id ==\nrequest.chapter_id && c.edition_id == request.edition_id &&\nc.delivered).size() == 1",
  "resultType": "bool",
  "fulfillmentRef": "fulfillment.access"
}
